{"blocks_on_semantic_effect_key":null,"current_leaf_external_dispatch_key":"dispatch-b41620733fb1a9fd607f8a5069be75ae1dc759e5","current_leaf_semantic_effect_key":"a9ca55daa5f1f626547d6745412cbe462db09d0ad8a69939340f217c90313523","current_proposal_id":null,"effect_lineage_id":"lin-c1183392c27037bd604077336d9d2fc1f1e03b78cf4da362","history_digest":"7cf286945eff8c35bd79ba9896142e082b14795e7fd1bc391f4fdf29dc121ce7","last_sequence":1,"predecessor_state":"NEVER_AUTHORIZED","relations":[],"schema_version":"ai-sdlc.effect-lineage-projection/v1"}
