{"blocks_on_semantic_effect_key":null,"current_leaf_external_dispatch_key":"dispatch-46e5a5e0cb425be7bde4bae79a213c73e3f85159","current_leaf_semantic_effect_key":"fc3138584cdd444592d14e26e69855b0bbab94bb36dbfcecb2d1e574f3ed42b8","current_proposal_id":null,"effect_lineage_id":"lin-0c077e9eae8dfc9592a69c49ec36cfd7ea7beb7f5efe4ba8","history_digest":"4a7c988d7b6523dce0d33377fdb3d140131aeb8b1bec308d713009d4b071b747","last_sequence":1,"predecessor_state":"NEVER_AUTHORIZED","relations":[],"schema_version":"ai-sdlc.effect-lineage-projection/v1"}
