{"blocks_on_semantic_effect_key":null,"current_leaf_external_dispatch_key":"dispatch-2bac24c52febbd295186dafb5113ec3fca4bdfd6","current_leaf_semantic_effect_key":"6084fa7e09acd63af025dede3167bd4a863bcf7da3772e6fb9079ecf4f87e2f6","current_proposal_id":null,"effect_lineage_id":"lin-232b381b219a119d89134fa8d4e6b8fed00ba5d47866ea96","history_digest":"805baddb59af93d207880f9531b6a66dee30e53544e38435a3743135f02033ac","last_sequence":1,"predecessor_state":"NEVER_AUTHORIZED","relations":[],"schema_version":"ai-sdlc.effect-lineage-projection/v1"}
