{"blocks_on_semantic_effect_key":null,"current_leaf_external_dispatch_key":"dispatch-6eeaa7ad0b848babafb1d9da726140013fd822c3","current_leaf_semantic_effect_key":"3fb52bd2f989fa06b0dc1a69f96aabbc181fbb9df7defc7d88e6b1eb8068890c","current_proposal_id":null,"effect_lineage_id":"lin-f9ef7cb17b5c357b0805a275d685c9b2752c4034a1698a23","history_digest":"0b8a1bfe3ecf5d58396d25be1ee8dae1772871a84d40673c86477d75dd0a573a","last_sequence":1,"predecessor_state":"NEVER_AUTHORIZED","relations":[],"schema_version":"ai-sdlc.effect-lineage-projection/v1"}
