{"blocks_on_semantic_effect_key":null,"current_leaf_external_dispatch_key":"dispatch-aeb9d8d32c6784cfc81f16230e44180c8c227867","current_leaf_semantic_effect_key":"130f2da7dced56c3e31fe8fd883bc1db1fe1adcb0a441f8f7365c0894f95f0ef","current_proposal_id":null,"effect_lineage_id":"lin-0b8525909eab295d4442afdae1e8cc2c4461ee5989d88745","history_digest":"a0cbd10e17f3a862d9a8044806dc7a4a8cca6fd3ac71d87ae7e51f963fe7d8a2","last_sequence":1,"predecessor_state":"NEVER_AUTHORIZED","relations":[],"schema_version":"ai-sdlc.effect-lineage-projection/v1"}
