{"blocks_on_semantic_effect_key":null,"current_leaf_external_dispatch_key":"dispatch-c045312cbf40f33f642b57bf6137f7dc9246f810","current_leaf_semantic_effect_key":"1661042122fd24f5a508e2faee894208fdfa3812462e5d9b1c11fe48bc1feda1","current_proposal_id":null,"effect_lineage_id":"lin-20bedfd659cc8745b1861fa1fd5e778a70e1397a4c00ead9","history_digest":"18fa34578f367d5b73f27950e7bc842e0b65f8fd482b0b9a37fede6ceff432c4","last_sequence":1,"predecessor_state":"NEVER_AUTHORIZED","relations":[],"schema_version":"ai-sdlc.effect-lineage-projection/v1"}
