{"blocks_on_semantic_effect_key":null,"current_leaf_external_dispatch_key":"dispatch-be7105dac9441164ef21865d97f7f9cba5eb4cec","current_leaf_semantic_effect_key":"d37a68e8ad594cd89a09649b44bff43dc27a342e1af9461fe5b61fa0e6ff1636","current_proposal_id":null,"effect_lineage_id":"lin-74530aee0e8f70ed39efb74fdf4ff48d38984ca15f1492d4","history_digest":"386000c661caca2b37cfd105eb764a6d4b49b95c900fd642faba5b541ef34455","last_sequence":1,"predecessor_state":"NEVER_AUTHORIZED","relations":[],"schema_version":"ai-sdlc.effect-lineage-projection/v1"}
