{"blocks_on_semantic_effect_key":null,"current_leaf_external_dispatch_key":"dispatch-d96a6ebde5af9bb3c1e598d7ddca07970ca1b7a0","current_leaf_semantic_effect_key":"8a0c1379e5a2589c1676241e068e82316ad5350d260e011fef755efb21918023","current_proposal_id":null,"effect_lineage_id":"lin-c6db501d95ee7dc988827348aaa7d7452e324ad300ae8137","history_digest":"b540c40be644ebf2746141b9a1dc4688333d7f84b5ef155a09fd22a91a0ce5bd","last_sequence":1,"predecessor_state":"NEVER_AUTHORIZED","relations":[],"schema_version":"ai-sdlc.effect-lineage-projection/v1"}
