{"blocks_on_semantic_effect_key":null,"current_leaf_external_dispatch_key":"dispatch-83fcb8afdb182c544b89e7305d16248152820738","current_leaf_semantic_effect_key":"1ebbfdc602cb987e2e6622b64a710648ff2e710d5a94502e4f7066226e8e9497","current_proposal_id":null,"effect_lineage_id":"lin-5aadc08c4e332e09049e60bfa153e1bc0012376d31400071","history_digest":"35b3ee9f0b65f2ad77306ead34d4f05a56a7bd766ee9a63f699434f391f81e7e","last_sequence":1,"predecessor_state":"NEVER_AUTHORIZED","relations":[],"schema_version":"ai-sdlc.effect-lineage-projection/v1"}
