{"blocks_on_semantic_effect_key":null,"current_leaf_external_dispatch_key":"dispatch-d62f52db3a0c92e1e74a9095a6ab3c0db070eec1","current_leaf_semantic_effect_key":"bfa22cb0a77c449d7cde62ff539869eacfa881904b9fc5d5663a0276fce9d4e7","current_proposal_id":null,"effect_lineage_id":"lin-dcb3556378fd1633dfb426b16f3139a4970cbbd675e897e0","history_digest":"f965e339c331f8c761e1fc2b429ab125f440f7002822e56ac2201a399138d960","last_sequence":1,"predecessor_state":"NEVER_AUTHORIZED","relations":[],"schema_version":"ai-sdlc.effect-lineage-projection/v1"}
