{"blocks_on_semantic_effect_key":null,"current_leaf_external_dispatch_key":"dispatch-a5358a5428e05ce673239a301daf63e497925664","current_leaf_semantic_effect_key":"077625be333456b6fab21a68d9ee2a2bfe731f6646f25da9b834072a152e4a4f","current_proposal_id":null,"effect_lineage_id":"lin-e0fc643601d392c26bc138c4c48bcfa0e200782b22a4ced4","history_digest":"1c15a76641b0da39acce916fd06b18699ba5cb37bcc8825d4f77835ab3fa0c4f","last_sequence":1,"predecessor_state":"NEVER_AUTHORIZED","relations":[],"schema_version":"ai-sdlc.effect-lineage-projection/v1"}
