{"blocks_on_semantic_effect_key":null,"current_leaf_external_dispatch_key":"dispatch-d96d3cb82eaf214d347509b687fe8bd81b86fe3f","current_leaf_semantic_effect_key":"80c908650f728899b937206d4230adb4fda0de072ffc9e1d5aa78a09fdcf292d","current_proposal_id":null,"effect_lineage_id":"lin-c4fdd40a6c05c5923ac1e28fbfeafcac322c6668ad091415","history_digest":"69aedcd7d5d87c5f6e741c07b95b4f0434a09535898bef7010a41988ce3dc673","last_sequence":1,"predecessor_state":"NEVER_AUTHORIZED","relations":[],"schema_version":"ai-sdlc.effect-lineage-projection/v1"}
