{"blocks_on_semantic_effect_key":null,"current_leaf_external_dispatch_key":"dispatch-17d6fcd6e738283bca4eaca6e3f3b99e97bdd6d1","current_leaf_semantic_effect_key":"2727c2da787c99a5bd6de338dfb2806ee4cc288973842b146b004b6953db2a71","current_proposal_id":null,"effect_lineage_id":"lin-38e174f1a5cb6d3efb5126db2f5cbb406a15c1dcbdf166d1","history_digest":"f7622f398d14c0e09d5476163905a0443471e523551ba0299e727b77fdd9b8c7","last_sequence":1,"predecessor_state":"NEVER_AUTHORIZED","relations":[],"schema_version":"ai-sdlc.effect-lineage-projection/v1"}
